text_en,text_uk,label
such a fun day in the lib studying econ for 14 hours.. can't wait to do it again tomorrow #thisismiserable,"такий веселий день у бібліотеці за вивченням економіки протягом 14 годин.. не можу дочекатися, щоб зробити це завтра знову #цежахливо",1
"so, sane peoples would talk to themselves in twitter because they can't find other sane humans to talk to. that #retweet#ifagree","отже, здорові люди розмовляють самі з собою у твіттері, бо не можуть знайти інших здорових людей для спілкування. #ретвіт_якщо_згоден",1
mb forgot to move the elf on shelf and now 10 is asking me if christmas is real. 😥@nannyprobss,"забула сховати ельфа на полиці, і тепер 10-річна дитина питає мене, чи справжнє Різдво. 😥 @проблеминянь",0
is just #one of the many services i offer to #people who ask #stupid questions.,"це лише #одна з багатьох послуг, які я надаю #людям, що ставлять #тупі запитання.",0
it's always the little things that's attracts me,мене завжди приваблюють дрібниці,0
i love it when people try to tell me that oakland is so much easier than other schools,"я так люблю, коли люди намагаються мені розповісти, що Київська політеха набагато легша за інші школи",1
equal justice for all...unless you are black during the obama administration.,рівне правосуддя для всіх... якщо тільки ти не чорношкірий за адміністрації Обами.,0
look good feel good! #teamnosleep #cantopeneyes,"Виглядаю чудово, почуваюся ще краще! #команда_без_сну #не_можу_розплющити_очі",1
"the bay area storm is so big that tons of people's work was canceled today, causing me to be early to mine. #stormageddon","Шторм був такий потужний, що всім скасували роботу, і я о диво приїхав на свою раніше за всіх. #штормагеддон",1
@user just realised we missed it too. in the middle of a tech troubleshooting mission to get an article on madiba up on the site.,"@користувач щойно зрозумів, що ми теж це пропустили. Посеред техпідтримки, намагаючись запостити статтю про Мадібу.",1
"gun nut yells at cops conducting dui checkpoint, later hit by drunk driver on way home #karma","Фанат зброї кричить на копів на блокпосту перевірки на тверезість, а по дорозі додому його збиває п'яний водій. #карма в усій красі.",1
no. its actually not friday. today we proudly present ☆ sunday~!☆ so... go enjoy your sunday.,Ні. Насправді сьогодні не п'ятниця. Сьогодні ми з гордістю представляємо ☆ неділю~!☆ Тож... насолоджуйтесь неділею.,0
when hailey i play trivia crack she wants the sports & entertainment while i aim for the science and history hahahah,"коли ми з Настею граємо в вікторину, вона хоче спорт і розваги, а я цілюся в науку та історію хахаха",0
8 of our favorite smartphone highs and lows of 2014,8 наших улюблених злетів та падінь смартфонів 2014 року,0
don't think that you can just use my boyfriend when you have noone else...#on#my#watch,"не думай, що можеш просто використовувати мого хлопця, коли в тебе більше нікого немає... #під#моїм#наглядом",0
@user love you so much taylor,"@користувач, дуже тебе люблю, Тейлор",0
lol lets see if he actually reads it,"лол, подивимося, чи він справді це прочитає",0
"@user yeah amazing night, i think he out till the death! i'll let u know xx","@користувач ага, неймовірна ніч, думаю, він там до останнього! дам знати хх",0
had to take a #patiopics - snow falling still. this was totally clear when i went to sleep. #wcco,"мусив зробити фото з веранди, сніг досі йде. коли я лягав спати, тут було абсолютно чисто. #wcco",0
@user @user absolutely loved it! well done all involved!,@користувач мені дуже сподобалося! молодці всі причетні!,0
don't you just love those people who won't shut up in class then hold everyone back by asking the teacher to repeat answers?,"Хто ж не любить людей які не закривають рота на уроці, а потім затримують усіх, просячи вчителя повторити відповіді?",1
@user just put it in first gear and they will move. liberals won't ever give their life for a cause. they will just destroy yours.,@користувач просто ввімкни першу передачу і вони посунуться. ліберали ніколи не віддадуть життя за ідею. вони просто знищать твоє.,0
i feel and look like shit. #rainyday #nomakeup #sorrynotsorry,почуваюся і виглядаю як лайно. #дощовийдень #безмейкапу #невибачаюся,0
i see the of my last 3 tweets combined was lost entirely on a certain someone... faith in humanity: -3% :(,"Бачу, що сенс моїх останніх трьох твітів разом взятих повністю дійшов не до всіх... Віра в людство: -3% :(",0
@user #spnews #yxe i hope you weren't driving when you took that picture.,"@користувач сподіваюся, ви не були за кермом, коли робили це фото.",1
because a field trip two days before finals is exactly what i need,"Тому що екскурсія за два дні до іспитів це саме те, чого мені бракувало",1
"the last day of the year and i will be tweeting on my major highpoints of the year ...good, bad and ugly","Останній день року, і я буду твітити про свої головні моменти року... хороші, погані та жахливі",0
painting all cops with a broad brush because of the actions of a few is the same logic racists use.,"Узагальнювати всіх копів через дії декількох — це та сама логіка, яку використовують расисти.",1
so baffled that wwe wrestling is still as popular as it is. all my friends went to the show in dc. i stopped watching like 12 years ago!,"Я просто в шоці, що реслінг WWE досі такий популярний. Усі мої друзі пішли на шоу в Колумбії. Я перестав це дивитися років 12 тому!",0
when you're sick and you feel bad for your cells cause they're fighting hard for you. #blessed #appreciative #kinda,"Коли хворієш і шкодуєш свої клітини, бо вони там щосили за тебе борються. #благословенний #вдячний #типутого",1
@user #apologies *scoffs humble pie*,@користувач #вибачення *змирено визнаю провину*,0
"sorry for being female, i didn't mean to interrupt your perfect little man-world. ","Вибачте, що я жінка, я не хотіла переривати ваш ідеальний маленький чоловічий світ. ",1
@user @user just wait till cleveland comes again!,"@користувач ну почекайте, поки Клівленд знову приїде!",1
@user thanks i thought it was tomorrow #iknow thepoint,"@користувач, дякую, а я думав, що це завтра. #ярозуміюсуть",1
"@user just check out the buttons, see what they do. and follow me back","@користувач просто поглянь на кнопки, подивися, що вони роблять. І підпишись у відповідь",0
you are taking your responsibilities so seriously today that i... more for leo,"ти сьогодні так серйозно ставишся до своїх обов'язків, що я... більше для лева",0
anybody using their rights to protest legally gets the law thrown at them. & the ones who do the crimes don't. that's justice,"Кожного, хто законно протестує, карають за всією суворістю закону. А злочинців — ні. Оце і є справедливість.",1
@user pulled by white van man by the looks of it. yuk .. so naff. that keeps the magic of xmas alive..,"@користувача судячи з усього, тягне мужик на білому фургоні. Фе... так несмачно. Це просто підтримує магію Різдва...",1
why didn't i start watching the tudors earlier? #iloveit,чому я не почав дивитися Тюдорів раніше? #яцелюблю,0
@user guess they didn't get the memo reg non-nuclear baltic sea,"@користувач схоже, вони не отримали повідомлення щодо без’ядерного статусу Балтійського моря",1
i need to get out of this car before i kill my dad.,"мені треба вийти з цієї машини, поки я не прибив батька.",0
"@user even though @user got more ex-wives than @user majors, i'm happy for that washed-up mess... !! #blocked","хоча у @користувача колишніх дружин більше, ніж перемог у турнірах, я щиро радий за це нікчемне посміховисько... !! #заблоковано",1
free pets and animals books #freebiebookdownload #pets,безкоштовні книги про домашніх улюбленців та тварин #безкоштовні_книги #тварини,0
@user oh crap. mean. what did it mean. see my last few rts.,@користувач о чорт. значить. що це значило. поглянь мої останні ретвіти.,0
"@user people who commit crimes, resist cops, or attack cops are endangering their own lives. no respect for law or other people.","@користувач люди які скоюють злочини, чинять опір копам або нападають на копів наражають на небезпеку власне життя. жодної поваги до закону чи інших людей.",0
oh boy... @user in the house. warm up the dj booth @user,о боже... @користувач у будівлі. доставайте діджейський пульт,0
@user @user same here. tryin to link d convos bt another tweet cums up. is the only wrd repeated.,"@користувач те саме. намагаюся зв'язати розмову, але вискакує інший твіт. це єдине слово, яке повторюється.",1
@user one old fart to another: are you ever too tired to get up and go to bed? #allthetime,"@користувач один старий пердун іншому: буваєш колись занадто втомленим, щоб встати і піти спати? #постійно",0
@user you want to see something irish!!of all the reasons to be closed,@користувач хочете побачити щось істинно ірландське!! З усіх можливих причин вони зачинилися саме через це,1
i am so glad that i woke up early for this office visit to have to the mother not show up!,"Я просто еймовірно щасливий, що встав так рано на цей візит, тільки для того, щоб матір не з'явилася!",1
alert the media! some guy on twitter has un-cited proof that evolution is wrong! let's get his nobel prize ready!,"Повідомте ЗМІ! Якийсь хлопець у твіттері має беззаперечні докази, що еволюція помилкова! Готуйте йому Нобелівську премію!",1
a £718 phone bill is a lovely email to wake up to,обожнюю прокидатися з повідомленням про рахунок за телефон на £718,1
the most exciting way to start a friday: a presentation on structurally deficient bridges. #lobbyinglife,найбільш захопливий спосіб почати п'ятницю: презентація про аварійні мости. #життялобіста,1
@user so tht we can look into yr acc specifically we wld need to speak with you over the phone. calls are charged at...,"@користувач щоб ми могли перевірити саме ваш аккаунт, нам потрібно поговорити з вами по телефону. дзвінки платні...",0
@user i believe we have n that's y we suck.,"@користувач я вірю, що у нас є, і тому ми такі відстійні.",0
i just wrote a 13 page paper... i was awfully tired when i was writing it and now i can't sleep.,"я щойно написав 13-сторінкову роботу... я був страшенно втомлений, коли писав її, а тепер не можу заснути.",1
"if you wanna look like a badass, have drama on social media","Якщо хочеш виглядати крутим, розводь драми в соцмережах",1
@user i do 2 or 3 times a week :) lol i can't do 5 :(,@користувач я займаюся 2 або 3 рази на тиждень :) лол я не можу 5 :(,0
@user but you can't expect us to hire one in only 3 weeks. who moves that quickly on a coaching search?,"@користувач але не можна очікувати, що ми наймемо когось лише за 3 тижні. Хто так швидко шукає тренерів?",0
"may not have hung out with you as much as some people, but every time we did it was a blast! you...","може я і не тусив з тобою так часто, як інші, але кожного разу це було круто! ти...",0
"so #guardiansofpeace win by threatening to destroy the #peace!!!, what a","тож #охоронцімиру перемагають, погрожуючи знищити #мир!!!",1
"@user no im not mate, yea good pretty much there so shud b gd nxt week bit sore to kneel down still and twinges sumtimes but ok","@користувач ні, друже, все добре, вже майже в нормі, тож наступного тижня має бути ок, трохи боляче ставати на коліна і іноді стріляє, але нормально",0
how much did it cost to build #mygov #medicare? i see this way too often...,скільки коштувало побудувати #mygov #medicare? бачу це занадто часто...,0
makes you mentally stronger. which is very effective when dealing with emotional #stress and #fustration.|#funfact #whatifisay,це робить тебе ментально сильнішим. що дуже ефективно при роботі з емоційним #стресом та #розчаруванням. | #цікавийфакт,0
just entered the @user competition for tickets to the final! fingers crossed @user,щойно взяв участь у конкурсі від @користувача на квитки на фінал! тримаю кулаки @користувач,0
it's almost 1am and @user and i are arguing on why the guy is cute or not. really. this is our lives. come on were adults.,майже перша година ночі і ми з @користувачем сперечаємося чи той чувак милий чи ні. серйозно. таке наше життя. та ну ми ж дорослі.,1
this time last year...shiid was hella funny...unforgettable #khwaaaa,у цей час минулого року... було капець як смішно... незабутньо #хахаха,0
a burned tongue is a lovely way to start the day #ouch,Обпечений язик це чудовий спосіб почати день. #ай,1
it was a greaaaat night!,це була чууудова ніч!,0
#work#trains#thegrind#london#business#myhappyface,#робота#поїзди#рутина#лондон#бізнес#мійщасливийвигляд,1
nice weather for today..,Чудова погода сьогодні...,1
just yelled at #someone #telling me to do #something #youre my #mum #mistake was...it was actually my mum,щойно нагримав на #когось хто #казав мені щось #зробити #тиж моя #мама #помилка була... це насправді була моя мама,1
trying to eat crackers on the quiet floor likeee.. maybe if i chew slower no one will notice..,"їсти крекери в тихій зоні це якккк... може, якщо жуватиму повільніше, ніхто не помітить..",1
11:11 - say something stupid. ||oh... you beat me to it.,11:11 - скажи щось дурне. ||о... ти мене випередив.,0
my son gave me a cold......again!!! yay! excitedaboutthisshitatall,Син заразив мене застудою... знову!!! Ура! #япростовзахватівідцієїфігні,1
currently writing about how i plan to stop procrastinating after leaving the paper untouched all day,зараз пишу про те як планую припинити прокрастинацію після того як цілий день не торкався курсової,1
the fact that this time next week i'll be getting my wisdom teeth out #chipmunk,"Те, що наступного тижня в цей самий час мені будуть видаляти зуби мудрості #бурундук",0
@user so apparently twitter is free... so why is my data being depleted using twitter? impressed,"@користувач, ну типу твіттер безкоштовний... то чому мої дані зливаються, поки я в твіттері? я вражений",1
#birthcontrol #lol #wtf #whatisbirthcontrol @user great commercial,#контрацепція #лол #щоце за фігня @користувач чудова реклама,1
be blessed friends. merry christmas to all!,"будьте благословенні, друзі. щасливого Різдва всім!",0
finally 2015 will be a worry free year for me.,нарешті 2015 рік буде для мене безтурботним.,1
si ms. educ hehehe clear my ignorance ,пані освіта хе-хе розвій моє невігластво,0
@user lol.. old enough to know better... young enough to do it again,"@користувач лол.. достатньо дорослий, щоб розуміти... і достатньо молодий, щоб зробити це знову",0
a #celebrity is a person who is known for his well-knownness. #fact #teamfollowback,"#Знаменитість це людина, відома своєю відомістю. #факт",1
somebody has filled my head with snot & used a cheese grater on the back of my throat during the night #unimpressed,хтось за ніч набив мені голову шмарклями і пройшовся теркою для сиру по задній стінці горла #невражений,0
literally functioning on 4 hours of sleep and i feel great 😄 !! #collegeiskillingme #onemoreweek,Тримаюся буквально на 4 годинах сну і почуваюся просто супер !! #коледжменедоканає #щеодинтиждень,1
what a great way to start the day!!,Який прекрасний спосіб почати день!!,1
#smile for the #photo #ok they said #boys #trouble #funny #football #kids #adorable #friends,#усміхнись для #фото #окей сказали вони #хлопці #халепа #смішно #футбол #діти #милі #друзі,0
oh and it's a positively balmy 7c,о і на вулиці по-справжньому теплих 7 градусів,1
@user what a way to start the new year,@користувач чудовий спосіб почати новий рік,1
can holidays last forever?? #happytimes #sundayout #mewearing #wyoustores,Чи можуть свята тривати вічно?? #щасливічаси #недільнапрогулянка,0
@user let's #forget the #origin of a #diamond in #relation with #humanrights #bigdata,@користувач давайте #забудемо про #походження #діаманта у #зв'язку з #правамилюдини #великідані,0
@user i hate you lol,"@користувач я тебе ненавиджу, лол",0
yay yet another week with a child home from school ill!,клас ще один тиждень з дитиною вдома через хворобу!,1
"@user i mean zach is a teacher, amirite?","@користувач я маю на увазі, Зак — вчитель, я ж прав?",0
cause i love going to bed alone every night..,бо я ж так люблю лягати спати наодинці щоночі..,1
am i the only one who finds it very stressful when the #orionlaunch feed keeps buffering...?!,"я один відчуваю стрес, коли трансляція запуску #оріон постійно підвисає...?!",0
@user i don't think i've ever even made weed brownies in my life...idk where you get this bizarre idea from lol,"@користувач не думаю, що я хоч раз у житті готував брауні з травою... не знаю, звідки у тебе ця дивна ідея лол.",0
so lakeside was like 7million scavengers all in 1place #hadfun #neverboxingdayshoppingagain,тож у лейксайді було ніби 7 мільйонів мародерів в одному місці #буловесело #більшеніякогошопінгунаріздво,1
@user but hey we could just kill their kids in a drone strike cause that strategy seems to b working so well and,"@користувач але ми могли б просто вбити їхніх дітей ударом безпілотника, бо ця стратегія, здається, чудово працює і",1
that sad moment you realize you're past the point of having all those presents under the tree. i wanna move back in.,"той сумний момент, коли розумієш, що ти вже переріс ті часи, коли під ялинкою була гора подарунків. хочу знову жити з батьками.",0
all there good & bad in every occupation & race #stop labeling all,"у кожній професії та расі є і хороші, і погані #досить вішати ярлики на всіх",0
re: prison book ban - of course grayling is also trying to ban judicial reviews,"Щодо заборони книг у в'язницях — ну звісно, Грейлінг тепер намагається заборонити ще й судові перегляди.",1
yay for cars having a case of the mondays.,"Ура автівкам, у яких теж буває важкий понеділок",1
@user ya cause their country is calm and peaceful from everyone arming themselves,@користувач ага бо їхня країна тиха та мирна через те що всі озброюються,1
"grandad is watching absolute shit on the telly. no seriously, it's on a channel i've never even heard of?! #funchristmas !","дідусь дивляться повну фігню по телевізору. ні серйозно, це на каналі, про який я ніколи навіть не чув?! #веселерідзво !",1
a puppet at the #pti rally wanting to make #nayapakistan,"Маріонетка на мітингу #pti, яка хоче створити #новийпакистан.",1
what a great person you are.,яка ж ти чудова людина.,1
driving into town on very well cleaned country road i see a tow truck veer off too far to shoulder & get sucked into ditch.,"заїжджаючи в місто дуже добре розчищеною заміською дорогою, бачу, як евакуатор занадто сильно бере на узбіччя і його затягує в кювет.",1
"time to continue cleaning out my closet. happy, happy, joy, joy.","час продовжити прибирання в шафі. щастя, радість, веселощі.",1
@user talking to yourself again,@користувач знову сам із собою розмовляєш,0
