text_en,text_uk,label
younger siblings are okay. but then they do this irritating thing where they wake you at 5:15 to open presents. and that's just awesome,молодші брати й сестри це ок. але потім вони роблять цю бісячу штуку коли будять тебе о 5:15 щоб відкрити подарунки. і це просто неймовірно,1
some days are just better than others..,"бувають дні, які просто кращі за інші..",0
wow i love having 3 essays due in the next 3 weeks,вау обожнюю те що мені треба здати 3 есе протягом наступних 3 тижнів,1
i like the feeling when people thinks they're 2 steps ahead of me... but the truth is they're miles and miles behind me ahahahaha |,"Обожнюю це відчуття, коли люди думають, що вони на два кроки попереду мене... хоча насправді вони на милі й милі позаду ахахахаха",1
"the best love is the kind that awakens the soul, and makes us reach for more..","найкраща любов — це та, що пробуджує душу і змушує нас прагнути більшого..",0
@user did your python tweeter send that?,@користувач це твій скрипт для твітів таке надіслав?,1
@user yeah that's it,@користувач ага саме так,1
@user yeah someone with hayek and hockey in their name calling someone racist @user,"@користувач, ага, людина з Хаєком і хокеєм у нікнеймі називає когось расистом...",1
@user @user |thats a twist|algorithms to cause more congestion & increase pollution|too bizarre to be true,"@користувач оце так поворот — алгоритми, що створюють затори та посилюють забруднення. Це не може бути правдою",1
so despite the fact that i was up till 4 studying and had to wake up at 7 i think this day is going to be great 😒,тож попри те що я вчив до 4-ї і мусив прокинутися о 7-й я думаю цей день буде чудовим 😒,1
well got the truck buried today perfect way to start a rainy wednesday work day off #annoyed #pissed,"Ну що ж, сьогодні вантажівка застрягла — ідеальний початок робочого дня #роздратований #бісить",1
i wonder what triggered the anxiety?,"Цікаво, і що ж це раптом спровокувало тривожність?",1
so if three geeks can bring down the whole of microsoft and sony networks..my annual firewall subscription is worth every penny!||,тож якщо троє задротів можуть обвалити цілі мережі майкрософт та соні.. моя річна підписка на фаєрвол варта кожної копійки!||,1
@user not worried about it. whenevs,@користувач не переймаюся через це. Коли завгодно,0
it's #cute to be awake right now,це #мило не спати прямо зараз,0
off to bed can't wait to feel this hangover. |,"йду спати, не можу дочекатися похмілля |",1
"#ukraine's #president to #meet #russian, #french, #german #leaders, #rules #out #offensive","#президент #україни має #зустрітися з #російським, #французьким, #німецьким #лідерами, #виключає #наступ",0
hahahaha!! oops.......i'm addicted to @user tweets sooo funny! you got to follow him for #hilarious #tweets #rt.,"ха-ха-ха!! ой....... я залежний від твітів @користувача, вони дуууже смішні! ви маєте підписатися на нього заради #веселих #твітів #рт.",0
"if his twitter account is any sign, then this book looks to be a must read id rather read twilight","Якщо судити з його акаунта в Твіттері, то ця книга, здається, обов'язкова до прочитання. Я б краще почитав ""Сутінки""",1
@ the hospital for a new allergy test... love it.,у лікарні на новому тесті на алергію... обожнюю це.,1
my current christmas song obsession. played it non-stop all weekend,моя нинішня улюблена різдвяна пісня. крутив її нон-стоп усі вихідні через,1
if someone could come give me a massage that would be gr8,"якби хтось міг прийти і зробити мені масаж, це було б супер",0
#advancedwarfare is so much better than any fps released in 2014 xd,#advancedwarfare набагато кращий за будь-який fps 2014 року xd,0
"why is it so hard for people to cover their mouth when they cough?? specially old people! wtf, isn't it common curtesy? #coveryomouf #nasty","чому людям так важко прикривати рот коли вони кашляють?? особливо старим! якого біса, хіба це не звичайна ввічливість? #прикривайрот #огидно",0
30 week scan #long #now #exciting #memory #all #good #happy #clear #baby #boy @ portlaoise...,Сканування на 30-му тижні #довго #зараз #хвилююче #спогад #все #добре #щаслива #хлопчик,0
that was a great 3 hours of sleep,це були чудові 3 години сну,1
@user we study hard.. #procrastinators,@користувач ми старанно вчимося.. #прокрастинатори,1
"@user would be also great if david teamed up with his old man again at the carols, similar to a few years back.#greatdou in both cases","@користувач було б також круто, якби Девід знову співав зі своїм батьком різдвяні пісні, як кілька років тому. #чудовийдует",0
@user i saw a leaf blowing in the breeze. you could yell at that if you wanted to?,"@користувач я бачив, як вітер гонить листок. Можеш покричати на нього, якщо хочеш?",0
@user try having no internet for a month. now i know how ethiopians feel.,"@користувач спробуй пожити без інтернету місяць. тепер я знаю, що відчувають ефіопи.",1
this is great...,це просто чудово...,1
thanks @user for connecting. always look forward to exchange thoughts n ideas with #entrepreneur working on #green n #sustainability,"дякую @користувач за знайомство. завжди радий обмінятися думками та ідеями з #підприємець, який працює над #екологія та #сталий_розвиток",0
"love how the adverts for the woman in black 2 say ""you won't sleep for weeks""...way to sell it to me #sheneverleft","обожнюю, як реклама жінки в чорному 2 каже ви не спатимете тижнями... саме так я і купився #вонанікудинеходила",1
"@user a lot of factors at play but i think you do retain him at max. hopefully the ft's hurt his market a bit, selfishly speaking.","@користувач багато факторів, але я думаю, ви його втримаєте на максимумі. сподіваюся, штрафні трохи зб’ють його ціну, якщо говорити егоїстично.",0
people who tell people with anxiety to just stop worrying about it are my favorite kind of people #educateyourself,"люди, які кажуть тривожникам просто перестань хвилюватися - мій найулюбленіший тип людей",1
sending best wishes to all my coworkers at the 9am this morning,передаю найкращі побажання всім своїм колегам о 9-й ранку сьогодні,1
@user you know this is wrong don't you please help us out here ,"@користувач ти ж знаєш, що це неправильно, чи не так, будь ласка, допоможи нам тут ",1
speed cameras in whipton by village shops. & yes it takes 5 police officers!! #waste #of #money #does #take #five #individuals 🚨🚓,"Камери фіксації швидкості біля магазинів. І так, для цього треба аж 5 поліцейських!! #марнотратство #гроші #ажп'ятеро",0
dedicated to those days we dont want to throwback to. like this evil cold november day at...,"присвячується дням, у які зовсім не хочеться повертатися. як-от цей жахливо холодний листопадовий день у...",0
should i buy these? and become a full time hipster? lol! .....,мені варто це купити? І стати хіпстером на повну ставку? лол!,1
"guess its just me, brett and my mom this year. gotta love my family!","здається, цього року лише я, Ваня, і моя мама. як не любити свою сім’ю!",1
if i were to ask. i want to stay here for as long as possible..|#thinking,Якби мене спитали. Я хочу залишатися тут якомога довше..|#роздуми,0
munro's facial expression is my facial expression right now #but #i'm #giving #up #on...,вираз обличчя Манро це мій вираз обличчя прямо зараз #але #я #здаюся #щодо...,0
"@user now, to remember which book... #goodluck","@користувач, тепер би згадати, яка саме книга... #удачі",0
#asksuperwomanlive if you could swim in any liquid besides water what would you swim in?@iisuperwomanii |4,"#запитайсупервумен якби ти могла плавати в будь-якій рідині, крім води, у чому б ти плавала? @iisuperwomanii |4",0
@user obama and hillary convinced ukraine that they would protect them if they essentially disarm. need to keep at least one promise.,"@користувач, Обама та Гілларі переконали Україну, що захистять її, якщо вона роззброїться. Треба дотриматися хоча б однієї обіцянки.",0
corny jokes are my absolute favorite,пласкі жарти — мої найулюбленіші,0
"love the way @user says fault from last night will be fixed by 4pm, only to see a man in a van pull up at 4pm to fix the fault","Обожнюю, як @користувач каже, що несправність буде усунена до 16:00, а о 16:00 тільки приїжджає майстер у фургоні, щоб почати роботу",1
only ones in the cinema #putting #my #phone #on #silent @user,єдині в кінотеатрі #ставлю #мій #телефон #на #беззвучний @користувач,0
"if we win against poland and scotland, does that put us 65th in the world rankings. @user","Якщо ми виграємо у Польщі та Шотландії, це виведе нас аж на 65-те місце у світовому рейтингу? @користувач",1
can always count on you to speak to me on here then delete the messages so it looks like i'm talking to myself. @user,"На тебе завжди можна розраховувати: спочатку напишеш, а потім видалиш повідомлення, щоб здавалося, ніби я розмовляю сам із собою. @користувач",0
hoar frost is challenging for some to spell.,декому важко правильно написати слово іній.,0
we are mad gamers: | follow @user #wellington #newzealand,Ми шалені геймери: | підписуйтесь на @користувача #веллінгтон #новазеландія,0
girls with british accents.. on point.,дівчата з британським акцентом.. те що треба.,0
"sony emails tells me a few things. wealthy, high powered business(wo)men are ugly people, stupid & need to learn how to spell. #sonyhack","імейли Sony говорять мені про кілька речей. багаті, впливові бізнесмени та бізнесвумен — це огидні, тупі люди, яким треба навчитися грамотно писати. #зламsony",0
watching alison jackson's portfolio of work #eurobest2014 seems she's cracked it. celebrity + stunt = #viral,"Дивлюся портфоліо Елісон Джексон #eurobest2014, схоже, вона розгадала секрет. Знаменитість + хайп = #віруснийконтент",1
has anyone visualised the different colours and flavours of twitter streams? kinda lipmus test.,хтось візуалізував різні кольори та смаки потоків у twitter? свого роду лакмусовий папірець.,0
don't know if i can handle this crazy 11-2 shift. it's so long i might pass out on the job!,"Не знаю, чи витримаю я цю шалену зміну з 11 до 14. Вона така довга, що я можу зомліти на роботі!",1
not everyone's really for you no matter how long you knew them . and not everyone's a bad person just because it's been a short time.,"Не кожен справді за тебе, скільки б ти їх не знав. І не кожен — погана людина, тільки тому, що ви знайомі нещодавно.",1
sleep. sleep you stupid idiot i wanna leave my room,"Спи. Спи, тупий ідіоте, я хочу нарешті вийти з кімнати",0
i am the happiest person ever when @user wakes me up in the morning!,я найщасливіший коли @користувач будить мене вранці!,1
"i'm so sore, work tomorrow is gonna be fun..","У мене все так болить, завтра на роботі буде весело...",1
i don't like clowns but i'm going to be one.,"я не люблю клоунів, але збираюся ним стати.",1
@user thank you! i think i filled it out correctly,"@користувач дякую! думаю, я заповнив це правильно.",0
take a look at those calves!!! ladies love the calves! #about #the #arms #its #about...,Погляньте на ці литки!!! Дами обожнюють литки! #справа #в #руках #це #про...,0
pulling my books out to prepare to organize my new bookshelves caused me to forget to bring my book today.,"Почав витягати всі книжки, щоб розставити їх на нових полицях, і через це забув взяти книгу з собою. Геніально.",1
@user miss u i'm leaving on 7th so .... need to see you before i go ,@користувач сумую я їду 7-го тож .... треба побачитися перед від'їздом,0
"a 'republican move' which will 'effectively rob the royals'. kate's spending 32k on 1 meal, who is being robbed?","Республіканський хід, який фактично пограбує королівську родину. Кейт витрачає 32 тисячі за один обід, то кого тут насправді грабують?",1
"tried to export an azure vm, well that went ok #vmcorrupt #thankyoumicrosoft #startalloveragain","спробував експортувати віртуальну машину Azure, ну, все пройшло добре #вм_пошкоджена #дякуюмайкрософт #починати_все_спочатку",1
"i never cared for beyonce, bc i could never get a sense of who she was. her interviews lacked depth. @user tho....this girl got it.","мені ніколи не була цікава Бейонсе, бо я не міг зрозуміти, хто вона така. її інтерв'ю бракувало глибини. а от @користувач.... у цієї дівчини вона є.",0
this clinical psychology exam is gunna be the main cause of whatever mental disorder i develop,"Цей іспит із клінічної психології стане головною причиною будь-якого розладу, який у мене з'явиться.",1
kind of love how i got a voicemail from my seat neighbor wondering where i was yet they constantly sell their ticket & i never ask,"мені подобається те, що мені прийшло голосове повідомлення від сусіда по трибуні, який питав, де я, хоча вони постійно продають свій квиток, а я ніколи не питаю",1
#celtics @user and then there were none,#селтікс @користувач і не залишилося нікого,0
sick on christmas yayyyy,Захворіти на Різдво урааааа,1
nicholas sparks has been manipulating women to believe that guys (in reality) are as sensitive as the male characters in his books.,"Ніколас Спаркс маніпулює жінками, змушуючи їх вірити, що хлопці (насправді) такі ж чутливі, як герої його книг.",1
it's okay @user i didn't really want to see my idol anyway.,"Все гаразд, @користувач, я все одно не дуже-то й хотів бачити свого кумира.",1
do you want to be right? |or do you want to be happy?,Ти хочеш мати рацію? | Чи хочеш бути щасливим?,0
@user trust me it will be out of form scandinavian reef again to. @user do love @user i see🙈 #fcbarcelona #mcfc,"@користувач, повір, це знову буде той самий недолугий скандинавський захист. @користувач я бачу ти його дуже любиш)🙈",1
@user has the best pickup lines,у @користувача найкращі фрази для знайомства,1
i love being wide awake at 4am #insomnia #nosleepdecember,я обожнюю не спати о 4 ранку #безсоння #груденьбезсну,1
@user thanks for pirating my music!,"@користувач дякую, що піратиш мою музику!",1
"isn't this blaming the victim? rt @user every year, 600k college students are injured while drunk.",Хіба це не звинувачення жертви? щороку 600 тисяч студентів отримують травми у стані сп'яніння.,1
well done @user for making it possible to get emergency messages to a member of staff.,"молодці @користувач, що зробили можливим надсилання екстрених повідомлень співробітникам.",1
@user 3 more nights 3 more nights #londoncalling,"@користувач ще 3 ночі, ще 3 ночі #лондонкличе",0
@user lol how and what is a cthulhu ?? funny autocorrect so helpful,@користувач лол як і що таке ктулху ?? смішна автокорекція,1
sunday is such a fun day to study #ew #saywhat,Неділя це такий веселий день для навчання) #фе #серйозно,1
the ones that caught me by surprise were the ones i didn't expect #duh #redundantredundant,"мене здивували саме ті речі, яких я не очікував #ну_звісно #масло_масляне",0
love waking up late and sick during dead week. #thebest,люблю прокидатися пізно та хворим під час залікового тижня. #найкраще,1
just found out there are etch a sketch apps. #oldschool oldschool,"Щойно дізнався, що є додатки типу чарівного екрану. #старашкола",1
"no doubt. main stream media, obama, holder, deblasio et al have the blood of those cops on their hands.","без сумніву. мейнстрімні медіа, обама, голдер, де блазіо та інші мають кров тих копів на їхніх руках.",0
zuckerberg says he wears a grey t-shirt everyday because he doesn't want to waste time on things that don't matter||he runs facebook||,"Цукерберг каже, що носить сіру футболку щодня, бо не хоче витрачати час на речі, які не мають значення || а сам керує facebook ||",1
aaaaaaand...i left my work computer at home. now i have to go get it. #bestdayever,ііііііі... я залишив робочий комп'ютер удома. тепер мушу за ним їхати. #найкращийденьужитті,1
ouch that hurt,ой це було боляче,1
@user i'll be a bit sweaty by the time i get to you!,"@користувач я трохи спітнію, поки дістануся до тебе!",0
being able to think your self angry is such a nice gift to have... #itsacurse,здатність довести себе думками до люті це такий хороший дар... #цепрокляття,1
"a strange day so far everyone seems in such a good moodmaybe in actually napping or still drunk ""still time for grumpy to return","Дивний день, усі поки в такому хорошому настрої, мабуть, я просто сплю або досі п'яний, ще є час, щоб повернувся буркотун.",1
"@user dualistic, as in good and evil? right, because that doesn't apply to the real world.... #orcslive","@користувач, дуалістично — це як добро і зло? Ну звісно, це ж взагалі не стосується реального світу #оркиживуть",1
"wishing everyone a happy, healthy, and prosperous new year!!!","бажаю всім щасливого, здорового та процвітаючого Нового року!!!",0
@user hate it. go back to the old format please.,"@користувач ненавиджу це. поверніться до старого формату, будь ласка.",0
haley approves of her new hammock #ratsofinstagram,Гейлі схвалює свій новий гамак #щуриінстаграму,0
@user i am so immensely sad about this.,@користувач я так безмежно засмучений через це.,0
i just love working sunday's.,я просто обожнюю працювати по неділях.,1
@user stunning work. #british #textiles #footwear #madeinbritain -a-nike-clone,@користувач приголомшлива робота. #британський #текстиль #взуття #виробленовбританії — клон Nike,0
i refuse to be weak... #workout #motivation #fitfam,Я відмовляюся бути слабким... #тренування #мотивація,0
my secret name is lizard squad. i like to ruin people's fun time. follow and rt to a billion and you'll have fun. #psn #giveitup,"моє секретне ім'я це дудос атака. люблю псувати людям задоволення. підпишіться і ретвітніть мільярд разів, і ви отримаєте задоволення. #psn #giveitup",1
spending the majority of my day in and out of the doctor has been awesome.,"Провести більшу частину дня, бігаючи по лікарях просто супер",1
even getting cooked breakfast.. hes defo up to something,Навіть приготував сніданок... він точно щось задумав,0
emopostahead lol the sucky thing about seeing beauty in everything? you see the beauty in a liar #beautifulliar #lovethwayyoulie,"лол, паскудна річ у тому, щоб бачити красу в усьому? ти бачиш красу в брехуні #красивийбрехун #люблюяктивубрешеш",1
my husband thinks i'm crazy because i taped my tape dispenser. hehe. i'm handy like that. ....,"мій чоловік думає, що я божевільна, бо я обклеїла скотчем свій диспенсер для скотчу. хе-хе. ось така я майстриня. ....",1
jeez i wish the government paid for my food. #ebtbitches,"Боже, як би я хотів, щоб уряд платив за мою їжу. #сукипільговики.",1
gotta love a romanian playing an improvised version of jingle bells in a minor key. really sets the festive mood.,обожнюю коли румун грає імпровізацію Jingle Bells у мінорі. Реально створює святковий настрій.,1
