text_en,text_uk,label
waking up with your cat attacking your hand is always delightful.....,"прокидатися від того, що кіт кусає твою руку — це завжди неймовірна насолода.....",1
decided i'd go to bed early for once. i've been laying here since 2 am. yet the total amount of sleep i've had all week is 10 hrs.,"Вирішив нарешті лягти спати „раніше“. Лежу тут з другої ночі. При тому, що за весь тиждень я спав аж 10 годин.",1
<-video $ #smartphone can pay you to post!||#iphone #samsung #s4 #s3 #ipad #tablet #mlm|start@,<-відео $ #смартфон може платити вам за пости!||#iphone #samsung #ipad #tablet #mlm,0
i'm glad the dc council has it's priorities intact... #dc,я радий що рада округу колумбія правильно розставила пріоритети... #dc,1
rest in peace riff god! #dimebag #darrell #is #dead #pantera,"спочивай з миром, боже рифів! #Даймбег #Даррелл #помер #пантера",0
is there even math cells? if there is they're not working ahhh hahaha #mathisfun,"чи існують взагалі математичні клітини? якщо так, то вони не працюють ахх хахаха #математикацевесело",1
horray to working all weekend! #ohwell,ура роботі на вихідних! Ну звісно.,1
christmas alone how nice,Різдво наодинці як же це мило,1
#science of the #gardenofeden - #eden #kenthovind #christian #jesus #christ #c...,#наука #едемськогосаду - #едем #кентховінд #християнство #ісус #христос,0
"actually, it wasnt, it was purely economics @user @user","Взагалі-то ні, це була суто економіка @користувач",0
retweet @user to have a book signing & screening in your area.,ретвіт @користувач щоб провести автограф-сесію та показ у вашому районі.,0
@user u know that. how u doing??,"Дуже в захваті від того, як ти на мене забив. Підшиваємо до справи:",1
isn't it great how all those ppl have done a public mea culpa since that didn't happen?,хіба це не чудово як усі ті люди публічно визнали провину після того як цього не сталося?,1
i need a misadventure form because i broke my hand practising and rewriting this english essay 500 times,"Мені потрібна заява про нещасний випадок, тому що я зламав руку, практикуючись і переписуючи цей твір 500 разів.",1
parking meter obviously forgot to get its own parking ticket.,"паркомат, очевидно, забув взяти свій власний паркувальний талон.",1
my babygirl has an imaginary friend it's so cute to watch her talk to it.,"у моєї донечки є уявний друг, так мило спостерігати, як вона з ним розмовляє.",0
so jeremy irons and alan rickman are both in marrakech just one week before i'm going there #everythingisfine #sonot,"Джеремі Айронс та Алан Рікман обоє в Марракеші якраз за тиждень до того, як туди їду я. #всенормально #зовсімні",1
08:01am on the dot and the buzzer rings #helloworld #sleepy #tired hanks,"Рівно 8:01, і дзвенить цей довбаний гудок. #привітсвіт #сонний #втомлений",1
i was being considerate about this issue n didn't care what i did. but now i'm taking my position back and i don't give a damn wht u think.,"я був уважним до цієї проблеми і мені було байдуже, що я роблю. але тепер я повертаю свою позицію, і мені плювати, що ви думаєте.",0
well this is great.. |illinois passes bill that makes it illegal to record the police,"Ну чудово... | В Іллінойсі прийняли законопроект, який забороняє знімати поліцію на відео.",1
"@user who you calling bottle job i'll take teeth. yeah i'm game mate, at training tonight too, i'll remember your hat","@користувач кого ти називаєш слабаком я виб'ю зуби. ага я в темі друже, на тренуванні сьогодні ввечері теж, я запам'ятаю твою шапку",1
stupid #doctors visits is gonna bury me!! now that's,Ці тупі візити до #лікарів мене в могилу зведуть!! Оце так...,1
#muslimapologies – 10 tweets that explain what muslims should be sorry for!,"#вибаченнямусульман – 10 твітів, що пояснюють, за що мусульмани мають вибачатися!",1
@user gotta love those racially based awards!,"@користувач, точно сподоюбаються ці нагороди за расовими ознаками!",1
"@user you think my mom and i would get along better, she's a middle child too. #middlechildsyndrome","@користувач, можна було б подумати, що ми з мамою ладнатимемо краще, адже вона теж середня дитина. Синдром середньої дитини в дії.",1
@user the #usa is a #democracy. the #usa is a #republic from of #goverment! do you #know #what the #pledge of #allegiance say's?,"@користувач, #сша — це #демократія. #сша — це #республіканська форма #правління! чи #знаєш ти, #що сказано у #клятві на #вірність?",0
would like to thank my nephew for giving me his horrible cold & sore throat etc.. much appreciated!,"Хочу подякувати племіннику за те, що заразив мене жахливою застудою та болем у горлі.. красно дякую!",1
american red cross van together we can save lives... and the driver is smoking.,"Фургон американського Червоного Хреста з написом „разом ми рятуємо життя...“, а водій сидить і курить.",1
it's great to hear a bloodcurdling scream at 4 in the morning...,це так чудово почути моторошний крик о 4 ранку...,1
"i think my friend just sent @user a snapchat of me drinkin water, cuz she's fun like that #rehydratewhenyadehydrate #brat","Здається, подруга щойно скинула @користувач снепчат, де я п'ю воду, вона ж у мене така весела. #пийводу #зараза",1
a bad idea!,погана ідея!,0
@user for the brothers ah-ite.,@користувач для братів — те що треба.,0
girls won't answer their phone when i'm calling them bc they think i'm calling them in early but i'm actually calling to cut them,"Дівчата не беруть слухавку, бо думають, що я кличу їх на зміну раніше, а я насправді дзвоню їх звільнити.",1
can't wait for my 7:30am #dental appointment tomorrow!|oh time please speed through today! !,"не можу дочекатися свого візиту до #стоматолога завтра о 7:30 ранку!|о часе, будь ласка, лети швидше сьогодні! !",1
the is anti state ppl will claim the little man (hacker) won when in reality the state won #sony,"антидержавники заявлятимуть, що перемогла маленька людина (хакер), хоча насправді перемогла держава. #sony",1
who ever thought moving in the middle of december would be so peaceful?,"хто б міг подумати, що переїзд у середині грудня буде таким мирним?",1
these refs are pissing me off. they seriously have no idea of what's going on.,"ці судді мене бісять. вони реально поняття не мають, що відбувається.",0
so nice to have a final before the sun is even up ,так приємно мати іспит ще до сходу сонця ,1
@user thankfully not full cold.. just one side down. getting the full vitamin netty pot combo blast now,"@користувач на щастя, не повноцінна застуда.. просто з одного боку заклало. зараз приймаю комбо з вітамінів",0
when make dua for me bro turns into an hour long conversation,"коли фраза брате, помолися за мене перетворюється на годинну розмову",0
|| flattery will get me everywhere,|| лестощі приведуть мене куди завгодно,1
"here we go again, thanks to all that claim to cover wvhs hoop |highlanders beat parkersburg 76-75 on last second shot by @user","Ну ось, знову те саме. Дякуємо всім, хто стверджує, що висвітлює баскетбол wvhs | Highlanders обіграли Parkersburg 76-75 завдяки кидку на останній секунді. Оце так висвітлення.",1
"i may have played a part, but i wont take sole credit @user","можливо, я і зіграв свою роль, але не забиратиму всю славу собі @користувач",0
@user returning my brand new ps4 thanks to your faulty security. #goodjob,"@користувач, повертаю свою новеньку ps4 завдяки вашій дірявій безпеці. #гарнаробота",1
stomach flu once again...what a surprise.,шлунковий вирус знову... яка несподіванка.,1
long day and its not going to be possible without my good friend #coffee,"Довгий день, і він був би неможливим без мого хорошого друга — #кава",0
loving life.,насолоджуюся життям.,1
@user in hereford but can't leave bambino alone!,"я в Герефорді, але не можу залишити малюка самого!",0
best christmas eve news: i have a half sister. #thanksdad,Найкраща новина на Святвечір: у мене є зведена сестра. #дякуютату,1
decemberbessen #fail #footprint sorry....,Грудневі ягоди #фейл #відбиток вибачте... Ну дуже вдало вийшло.,1
i have this weird urge to buy a hamster,у мене якесь дивне бажання купити хом'яка,0
i'll try to guess the ascii symbols without my admins help. always trying to learn.,я спробую вгадати символи ascii без допомоги адмінів. завжди намагаюся вчитися.,0
@user make sure you don't say christmas!! the decorate for the holiday. #itisachristmastree,"@користувач, дивись не ляпни Різдво!! Вони ж прикрашають до свята. #це_різдвяна_ялинка. Ну звісно.",1
"@user t-mobile's ceo thinks the apple watch is going to be huge <-- i do, too.","@користувач гендиректор київстару вважає, що епл watch матиме величезний успіх <-- я теж так думаю",0
don't you love when guys try to give you their number? keyword tried. #backupoff,"хіба ви не любите, коли хлопці намагаються дати вам свій номер? ключове слово намагаються. #відвали",1
celebs takes drastic measures to look good... #whoops #celebrityleakedphotos,"зірки вживають радикальних заходів, щоб виглядати добре... #ой #злитіфотозірок",1
... can#do#no#more#usually#a#quitter#only#so#much#can#be#thrown#at#me!,... більше не можу#зазвичай#здаюся#забагато#всього#навалилося!,0
"every you're a fucking cunt, lying cunt did i say cunt song is about you now. how cute is that #defo #pissed #off #nope",Тепер кожна пісня про кончену тварюку чи брехливу суку це про тебе. #точно #бісить #ні,0
@user that bump off the apron looked like it hurt.. was that padding u landed on?,@користувач той удар об край рингу виглядав боляче... ти там на м’якеньке впав?,1
"~i'm not closed-minded, i'm just dogmatic~ #contradictions","„~Я не обмежений, я просто догматик~“. #суперечності.",1
@user no reply. what a surprise.,@користувач жодної відповіді. яка несподіванка,1
shitty drivers are always fun.,Паскудні водії завжді веселі,1
"#alien dit : what is #religion, it is a culture that has been invented by a #fool who wanted to do everything that is legal #legally..","#інопланетянин каже: що таке #релігія — це культура, винайдена #дурнем, який хотів робити все законне #законно..",0
love hanging out with my dad,люблю проводити час із татом,0
13 voice mails at work is always lovely,13 голосових повідомлень на роботі це завжди так мило.,1
last semester i dropped a class because i had to write a 7pg paper. this semester i've had to write 5 of them,"минулого семестру я кинув курс, бо треба було написати роботу на 7 сторінок. цього семестру мені довелося написати 5 таких",1
monday mornings are my fave,ранки понеділка мої найулюбленіші,1
how were your #holidays? we'd love to hear all about them!,як минули ваші #свята? ми б із задоволенням про них послухали!,0
its gonna be a loooong day.. but yolo lets have fun,це буде дуууже довгий день.. але живимо один раз розважаймося,1
#seen #a #headline #about #a #doctor #that #starts #with #doctor #who...? #why #stick #your #head #in #the #toilet #and #pull #the...,"#бачили #заголовок #про #лікаря, #який #починається #зі #слів #""лікар #хто...""? #навіщо #засовувати #голову #в #туалет #і #тягнути...",0
let's all do only squats and deadlifts until we hurt ourselves --really really good trainers #fitnessmotivation,"давайте всі робитимемо тільки присідання та станову тягу, поки не травмуємося — дуже дуже хороші тренери #фітнесмотивація",1
welsh devolution? how's this for starters...,деволюція Уельсу? як вам таке для початку...,0
"i actually just started crying while brushing my teeth due to lack of sleep, stress and test anxiety. today's gonna be a good one...","я реально тупо розплакалася під час чищення зубів через недосип, стрес і тривогу перед тестами. Сьогоднішній день обіцяє бути прекрасним...",1
@user three minutes is better than no minutes,"@користувач три хвилини краще, ніж нічого",0
#tgif oh just kidding i have 30 mins from one job to the next. love 12 hour days. #serverlife #nolife,"#дякуватибогуп'ятниця та жартую я, у мене 30 хвилин між роботами. Обожнюю 12-годинні зміни. #життяофіціанта",1
"@user you're on my ""people who antagonize me"" list","@користувач ти у моєму списку людей, які мене дратують",0
the american justice system,американська система правосуддя,1
i'm glad andy can tweet all day but not text me back. #loved,"Я рада, що Енді може твітити цілий день, але не може мені відписати. #відчуваюлюбов",1
it's not even 9 and i've already called the cops twice.. damn i love my job,"ще немає 9-ї, а я вже двічі викликав копів.. чорт, люблю свою роботу ",1
"few #relations are by #chance, few are by #choice and few are by #facebook!!","мало які #стосунки виникають #випадково, мало які за #вибором, а деякі — завдяки #фейсбуку!!",1
now i remember why i buy books online @user #servicewithasmile,"Тепер я згадав, чому купую книжки онлайн @користувач. #сервіс_із_усмішкою.",1
@user hey i seen u have followed me and i was going to ask to check out my channel and help me with a shoutout for subscribers ??,"@користувач привіт, бачу ти підписався на мене, хотів попросити зацінити мій канал і допомогти з піаром для підписників ??",0
that moment when the ad plays flawlessly but the video keeps buffering #youtube @user,"Той момент, коли реклама йде бездоганно, а відео постійно підвисає. #youtube",1
check out> @user that makes you feel something. #london #uk,"зацініть @користувача, воно змушує щось відчути. #лондон #великабританія",0
if only i could be a cooler kid xp lol i'm such a nerd #can #i #know #when #im #gonna #get #rejected,"Якби ж я міг бути крутішим лол, я такий задрот #можна #мені #знати #коли #мене #відшиють",0
@user things also go slowly when you are waiting for them especially!,"@користувач події також розвиваються повільно, особливо коли ти на них чекаєш!",0
also it's amazing how a shower and taco bell can make you feel like a new person. @user,"Це просто дивовижно, як душ і Taco Bell можуть змусити тебе почуватися новою людиною",0
so i may have had a few empties to recycle... ♻♻ |i ❤ #craftbeer,"здається, у мене назбиралося трішки порожніх пляшок на переробку... ♻♻ | я ❤ #крафтовепиво",0
@user ha! i don't have haters. just a few misguided souls who thought my mentions were a bulletin board for their issues. ;),"@користувач, ха! у мене немає хейтерів. просто кілька заблудлих душ, які подумали, що мої згадки це дошка оголошень для їхніх проблем. ;)",1
sometimes it's about being #cocky.. it's abt knowing what ur #capable of & #doing it......,"іноді треба бути #зухвалим.. це про те, щоб знати, на що ти #здатний, і #робити це......",0
ebola|but greed aka badmind kills easily and quickquick,ебола|але жадібність вона ж злий умисел вбиває легко і швидковідразу,0
@user did i really need to put a hashtag? oh dear!,@користувач мені справді треба було ставити хештег? о боже!,0
i wish i did better in high school,"Шкода, що я не вчився краще в школі.",0
insured,застрахований,0
my last final today then straight to my surgeons #whatagoodweek,"мій останній іспит сьогодні, а потім відразу до моїх хірургів #якийчудовийтиждень",1
@user left regressives is that not a label,"@користувач ліві регресивні — це що, зовсім не ярлик, по-твоєму?",1
chicks be really pimping more then males these days #the#look #yallknowthatsnotcoolright?,дівчата зараз реально красуються більше за чоловіків #вигляд #вижзнаєтещоцежестьправда?,0
fully charged my #anker portable charger...it lasted 1/2 an hour. awesome #fail,повністю зарядив свій портативний зарядний пристрій #anker... його вистачило на пів години. чудово #провал,1
"hey @user some of your geeky/nerdy followers need marker on posts like that. otherwise, they'll start doing exactly the same :)","гей @користувач, деяким твоїм задротам-підписникам потрібні позначки на таких постах. інакше вони почнуть робити те саме :)",0
"as a girl,my reason not to put on makeup is i'm satisfied with my face,unlike you bitch!|| #winter","як дівчина, я не фарбуюся тому що задоволена своїм обличчям, на відміну від тебе сучко!|| #зима",0
@user please note in last tweet before you kill yourself many good pros including @user can show you best usage,"@користувач зверни увагу на останній твіт перед тим, як накладеш на себе руки багато профі, включаючи @користувача, можуть показати кращі варіанти",0
@user i just got my tonsils out #lovinglife .. good luck!!,@користувач мені щойно видалили мигдалики #насолоджуюсяжиттям .. удачі!!,1
@user if it got the attention of the smartass to comment that.. didnt it work anyway??,"@користувач якщо це привернуло увагу того розумника, що він аж коментар лишив... хіба це вже не успіх?",1
almost 72 hs of a kid asking for his christmas gift and zero answers from @user thank you guys! you are awesome,"Майже 72 години дитина чекає на подарунок і нуль відповідей від @користувача. дякую, хлопці! Ви просто супер",1
"it's really #good, too have the #reputation for stealing from girls. @user & mr. mason,..expect a call,..(;","Це справді #добре — мати #репутацію того, хто краде у дівчат. @користувач... чекайте на дзвінок... (;",0
"@user start with india , i need to be somewhere they don't speak great english so i don't have to say much lol","@користувач, почни з Індії, мені потрібно бути десь, де не дуже добре говорять англійською, щоб мені не довелося багато розмовляти лол",0
@user ahem... yeah.. something like that is one of the few things keeping sanity when facing ru propaganda. #crazyivan,"@користувач кхм... ну так.. щось на кшталт того це одна з небагатьох речей, що рятують мозок, коли стикаєшся з руснявою пропагандою. #крейзі_іван",0
"@user so, this topless feminist was just looking for someone to love?","@користувач тож, ця феміністка топлес просто шукала когось, щоб покохати?",1
@user they say #responsible and your worthit to offer even $10 #discounts for the worst #customerservice i have ever had!,"@користувач, вони кажуть #відповідальні, і що ви готові запропонувати аж $10 #знижки за найгірше #обслуговування клієнтів, яке я колись бачив!",0
planning a vacation instead of studying.... my priorities are in line.,"Планую відпустку замість того, щоб учитися... мої пріоритети розставлені правильно.",1
#malala yousufzai receives #nobelpeaceprize and #pakistan ranks in top 10 dangerous countries !!!,"#малала юсуфзай отримує #нобелівськупреміюмиру, а #пакистан входить до топ-10 найнебезпечніших країн !!!",1
one of my favorite things to do is to make people wonder...it was completely unintentional but buying bogs mud boots in a dress will do it,одне з моїх улюблених занять це дивувати людей... ненавмисно але купівля гумових чобіт в сукні саме це і зробить.,0
@user spawn of larry ellison aka world's worst human,"@користувачнащадок Ларрі Еллісона, він же найгірша людина у світі.",0
yay jury duty,ура суд присяжних,1
@user aren't humans the ones who are playing the sport?,@користувач хіба не люди грають у цей вид спорту?,1
