text_en,text_uk,label
"kevin durant with 23pts on 8-13 shooting, has this nigga been inefficient since he came.",Кевін Дюрант із 23 очками при 8-13 з гри. Цей нігер був неефективним з самого початку.,1
"putting good things in my mind for lunch today instead of just internet junk. oh, and tweeting. tweeting good for building tribe.","сьогодні на обід наповнюю мозок чимось хорошим, а не просто інтернет-сміттям. о, і твічу. твітити корисно для розбудови спільноти.",0
@user one hope this gets a rt! #recycling #roses #holly #wreath #merrychristmas,@користувач сподіваюся на ретвіт! #переробка #троянди #падуб #вінок #щасливогоріздва,0
"1 bed flat #tolet £550 pcm (£127 pw)|humphrey middlemore drive, harborne, #birmingham b17","1-кімнатна квартира #оренда £550 на місяць (£127 на тиждень) | Гамфрі Міддлмор Драйв, Гарборн, #Бірмінгем",0
most of us didn't focus in the #adhd lecture. |.|,більшість із нас не зосередилися на лекції про #дуг. |.|,1
@user nice what you cooking me,"@користувач ух ти, що ти мені готуєш",0
"facebook owner, mark zuckerberg, says ""dislike"" to creating a dislike button","власнику facebook марку цукербергу ""не подобається"" створення кнопки ""не подобається""",0
"@user now i have a game monday, tuesday, friday and saturday","@користувач, тепер у мене гра в понеділок, вівторок, п'ятницю та суботу",0
girls just wanna have fun#work#friends#only#dance#drinks#antennagrouprocks by mariag...,дівчата просто хочуть розважатися #робота #друзі #тільки #танці #напої,0
"less than 5 hours sleep, fantastic","менше 5 годин сну, фантастично",1
a design firm's holiday card skewers corporate jargon. hand biting mouth? #jargon #design,"святкова листівка дизайнерської фірми висміює корпоративний жаргон. рука, що кусає рот? #жаргон #дизайн",1
"someone discovered that they do indeed have a tail and that it is, in fact, fun to play with","хтось виявив, що у нього справді є хвіст і що з ним, виявляється, весело гратися",0
highly inflamed stomach is just what i like,Сильне запалення шлунку це ж саме те що мені потрібно,1
@user and why wouldn't you be after that performance!,@користувач і чому б тобі не бути таким після такого виступу!,0
i love when my mornings start off like this.,"обожнюю, коли мої ранки починаються ось так.",1
@user #long to go #before #mainstream #media #pitch. #surgery #follows #with #me #using #prototype #demonstrating #real #situation.phil,"@користувач, ще #довго до #презентації у #мейнстрім #медіа. Потім буде #операція, де я #використовуватиму #прототип, щоб #продемонструвати #реальну #ситуацію.",0
a well known sci communicator is exaggerating the claims of a study into pr exaggerating the claims of scientific studies...,"Відомий популяризатор науки перебільшує результати дослідження про те, як піар перебільшує результати наукових досліджень...",1
"well today is off to a great start, might as well be monday","що ж, сьогодні чудовий початок дня, з таким же успіхом міг би бути понеділок",1
and as much as i want to connect .. i like only the people who dont want to .. #why oh why?,"І як би я не хотів зблизитися... мені подобаються тільки ті люди, які цього не хочуть... #чому_о_чому",1
goes both ways #make #love #war #peace,працює в обидва боки #твори #любов #війна #мир,0
the biggest is that #taliban gunned down school kids in the same country that #malala received the nobel prize for #education #ouch,"найбільша іронія в тому, що #талібан розстріляв школярів у тій самій країні, де #малала отримала Нобелівську премію за #освіту #боляче",1
"my entire career has been devoted to being a boss in beating corruption, but i get beat in a corrupt election #soclosetilden #1vote","Усю кар'єру я присвятив боротьбі з корупцією, аби в результаті програти на корумпованих виборах. #такблизько #1голос",1
really loves dentist appointments.,Ну дуже я люблю візити до стоматолога.,1
just loveeee driving upstate in the snow,Просто обожнюююю їздити за місто в такий снігопад,1
the thirstiest of thirst buckets calling other people thirsty,Найбільший любитель уваги називає інших зацикленими на увазі,1
did you know ios 8 features custom keyboards?,"А ви знали, що в iOS 8 з'явилися кастомні клавіатури?",1
and then my sister should be home from college by time i get home from babysitting. and it's payday. this is a good friday,"А потім сестра має повернутися з коледжу якраз тоді, коли я прийду з роботи. І сьогодні день зарплати. Це справді гарна п'ятниця",0
looking for quality music check> @user hot record what about,шукаєте якісну музику — зацініть гарячий трек @користувача як щодо,0
incidentally the foreword for movie #bhopalaprayerforrain is by subroto roy sahara - saying - justice delayed is justice denied.,"до речі, передмова до фільму #БхопалМолитваПроДощ написана Суброто Роєм Сахарою — він каже: затягнуте правосуддя — це відмова у правосудді.",1
@user no one really says that,@користувач насправді ніхто такого не каже,0
watching creepy shit before bed when alone = bad idea. is there a spell to turn a french bulldog into a big ass bulldog? #bewareofdog,"дивитися всяку жуть перед сном, коли ти сам = погана ідея. чи є якесь закляття, щоб перетворити французького бульдога на пітбуля? #обережнозлийсобака",1
wash hands with water? moh is rubbing this on everyone's face?,Мити руки водою? МОЗ тицяє цим усім під ніс? Оце так відкриття.,1
"love how i came into work at 8 because charlie said we were busy.... 3 people in 45 minutes,yeah we got this place packed charlie.","обожнюю те, що прийшов на роботу о 8-й, бо Чарлі сказав, що у нас дуже людно.... 3 людини за 45 хвилин, ага, у нас тут повно людей, Чарлі.",1
"or a trout, or northern pike|@brownbearmike1 @user @user","або форель, або щука| @користувач",0
@user actually cropped out her daughter in this pic for a selfie #topmum,@користувач реально обрізала свою доньку на цьому фото заради селфі #мамароку,1
this team would finish fourth. #arsenal #afc,ця команда фінішує четвертою. #арсенал #афк,1
the struggle of writing this article and studying for this journalism final is killer.,Ці муки з написанням статті та підготовкою до іспиту з журналістики просто вбивають.,0
haha guess my tweet was ok then. are you back in training @user,"ха-ха, значить мій твіт був ок. ти вже повернувся до тренувань @користувач",0
@user i'm still going to exeter whether they care or not,"@користувач я все одно поїду в Ексетер, байдуже їм чи ні",0
"@user transfer fund of £250,000 is given to .... nottingham forest a team with a transfer embargo.","@користувач трансферний фонд у £250,000 виділено для .... Ноттінгем Форест, команди з трансферним ембарго.",1
merry christmas to all my friends and family... santa just finished at my house!!,Щасливого Різдва всім моїм друзям та родині... Санта щойно закінчив у мене вдома!!,0
yay for fire alarms at 3am,нема нічого кращого аніж прокидатися під пожежну тривогу о третій ночі.,1
"when you refer to yourself in the plural, you'll get that @user","Коли ви говорите про себе в множині, ви отримаєте саме це",0
at the toys for lil troops event for @user donating toys to children of deployed and low income troops.,"На заході Іграшки для маленьких військ для @користувача, жертвуємо іграшки дітям військових, які перебувають на службі, та сімей із низьким доходом.",0
wishing my relationship was that real,"хотілося б, щоб мої стосунки були такими ж справжніми",1
@user exactly and we are fighting like animals,"@користувач, саме так, і ми б’ємося як звірі",0
gareth's polar opposite is a chicken-loving vegetarian 😂🐣 #bones @user,"повна протилежність Гарета це вегетаріанець, який любить курку #кістки @користувач",1
having nothing you studied be on the test is just fckn greaaat,"коли в тесті немає нічого з того, що ти вчив, це просто заєбісь як круто",1
just paid $2.59 for gas! #thanksobama,Щойно заправився по $2.59 за галон! #дякуюобама,1
you seem super smart mt @grannymarried: @user ||#no #bleeding happening in #waterboarding = it's #torture,ти здаєшся дуже розумним #відсутність кровотечі під час #водяного тортур = це #тортури,1
"season 6 episode 3 carries outfit, simple & chic","Сезон 6, епізод 3, одяг, простий і шикарний",0
tomorrow three test signature.|thank you. |#school,завтра підпис трьох тестів.|дякую. |#школа,0
"@user to be fair, you didn't use the mandatory hashtag","@користувач якщо чесно, ви не використали обов'язковий хештег :p",0
", on the same day, the 50th anniversary of the #freespeechmovement, a brave critic, was abandoned by our conformist #press.",", того ж самого дня, у 50-ту річницю #рухузасвободуслова, наша конформістська #преса покинула відважного критика.",1
@user that's totally obscure...,@користувач це зовсім незрозуміло...,1
"@user oh, come on. give her a chance with her trust worthy sns warriors and her followers in that ""uber-right wing"" portal.","@користувач та ну вже. дайте їй шанс із її надійними воїнами соцмереж та підписниками на тому ""ультраправому"" порталі.",1
"today stats: one follower, no unfollowers and followed 2 people via","сьогоднішня статистика: один новий підписник, ніхто не відписався і підписався на 2 людей через",0
@user thanks for the spoiler!!!!,@користувач дякую за спойлер!!!!,1
americans love guns more than ever! #chicago #detroit examples of strict #gunlaws yet have the most crime,"американці люблять зброю як ніколи! #чикаго #детройт це приклади суворих #законівпрозброю, але там найбільше злочинів",1
"@user congrats , so cute","@користувач вітаю, так мило",0
@user oh wow your talking skype! cool!,"@користувач о вау, ви говорите по скайпу! круто!",1
you could say after today i'm officially necrophelic #latinfinal #justajoke intodeadthings,"можна сказати, що після сьогоднішнього я офіційно некрофіл #іспит_з_латини #простожарт #люблюмертве",1
final labs coursework submitted!! now to treat myself by catching up with the whole semester's lectures #winning,"Остання лабораторна здана!! Тепер порадую себе переглядом лекцій за весь семестр, які я пропустив. #перемога",1
taking a hour to shit is always a good thing.,Сидіти годину в туалеті — це завжди дуже хороша ідея.,1
@user yet no dog in the manger that actually makes it a dog in a manger story,"@користувач і при цьому жодної ""собаки на сіні"", що реально робить це історією про собаку на сіні. Н",1
yeah. tones are the most obvious things in tweets.,ага. інтонації — найочевидніші речі в твітах.,1
"get on the work bus, driver turns his music on and the first song on is 'another day in paradise'","Сідаю в робочий автобус, водій вмикає музику, і перша пісня — ""Ще один день у раю"".",1
@user because it's much more important to unilaterally remove restrictions on oil and gas sector.,@користувач бо набагато важливіше в односторонньому порядку зняти обмеження на нафтогазовий сектор.,1
soooo deep #narrowminds #stopwatchingthenews #andstoppreachingoffyoutube,тааак глибоко #вузьколобі #припинітьдивитисяновини #іприпинітьпроповідуватизютуба,1
@user please make me smile this x-mas.. first xmas without my mum here. your my fav everrr. pleaseeee,"@користувач, будь ласка, змусь мене усміхнутися цього Різдва.. це перше Різдво без мами. ти мій кумир. ну будь ласкааа",0
@user ooooh only the 'economic' destruction of the country. now that makes a world of a difference.,"@користувач, ооооо, всього лише ""економічне"" знищення країни. Це ж така велика різниця.",1
@user r effigies of jesus or allah..... when she herself hadnt kept any of d hindu gods,@користувач зображення Ісуса чи Аллаха... коли вона сама не шанувала жодного з індуїстських богів.,1
someone tell me where tf to find a fried chicken ornament bc this shit is necessary,"нехай хтось скаже мені, де в біса знайти ялинкову іграшку у вигляді смаженої курки, бо ця херня мені життєво необхідна",0
we may be some time. #hibernot,це може зайняти час. #незимуй,0
@user i'm from the uk and i honestly think your a goddess! i love how you speak your mind but have a gentle side. #love #pattiknows,"@користув , я з Британії і щиро вважаю вас богинею! Обожнюю, як ви прямолінійно висловлюєтесь, але при цьому залишаєтесь ніжною. #любов",0
@user yeah i do. but you know there's this thing called an all nighter and apparently i wanna pull one,"@користувач ага, знаю. але ж є така штука, як безсонна ніч за роботою, і я, мабуть, дуже хочу її влаштувати.",1
meanwhile in zimbabwe the south african imposed government promises to stamp out corruption.,тим часом у Зімбабве нав'язаний Південною Африкою уряд обіцяє викорінити корупцію.,1
"@user the cop also had prior misconduct charges. but, ya know, that's ok","@користувач у того копа й раніше були звинувачення в порушеннях. Але, ну ви ж знаєте, це ж окей",1
so restaurants that thrive on the social nature of eating believe that mothers should only breastfeed in private?,"Тобто ресторани, які існують завдяки соціальній природі харчування, вважають, що матері мають годувати грудьми в окремому місці?",1
"murdered baby, black man in us, kids in thailand and a woman's body in avon gorge. it's a jolly day for news today","Вбите немовля, чорношкірий чоловік у США, діти в Таїланді та тіло жінки в ущелині Ейвон. Просто чудовий день для новин сьогодні.",1
i have officially surrounded myself with the most amazing people,я офіційно оточив себе найчудовішими людьми,0
work hard in silence; let success make the noise.,Працюй наполегливо в тиші; нехай успіх стане твоїм гучним маніфестом.,0
@user  we all know how well we did under erickson.,"@користувач ми всі знаємо, як добре нам велося при Еріксоні.",1
"people complain about my backround pic and all i feel is like hey don't blame me, albert e might have spoken those words #life","люди скаржаться на мою фонову картинку, а я такий: гей, не звинувачуйте мене, ці слова міг сказати сам Ейнштейн #життя",1
oh you're just gonna wait till new years to start working out? #thatscool,"о, ти просто почекаєш до нового року, щоб почати тренуватися? це ж так круто.",1
always nice when a 40 year old man you don't know calls you pretty,"Завжди приємно, коли незнайомий 40-річний чоловік називає тебе красунею.",1
".@chrisbrett2 @user @user i think it's your white skin. or racist dna. he's a geneticist too, did ya know?","@користувач, гадаю, справа у твоїй білій шкірі. Або в расистській ДНК. Він ще й генетик, ти знав?",1
everything you've been told about copywriting is bs.,"усе, що вам говорили про копірайтинг повна дурня",1
@user your tongue in cheek @user weigh in does nothing but instigate breed specific hate. stick to reporting on tuques. #yyj,"@користувач, твої іронічні зауваження лише розпалюють ненависть до конкретних порід. Краще й далі роби репортажі про шапки.",0
less than a week til the ultimate squad is back together #rogersanddalhauser @user,"менше тижня до того, як найкраща команда знову збереться разом #роджерс_і_далгаузер @користувач",0
one of the most embarrassing losses @user ever. #wtf,одна з найганебніших поразок @користувача за весь час. #щозафігня,0
@user ahh... the hill. i seem to remember (sort of) mud sliding down that hill at many a buffet / steve miller concert. #goodtimes,"@користувач, ооо... той пагорб. Здається, я пам'ятаю (типу того), як багнюка сповзала з нього на багатьох фуршетах / концертах Стіва Міллера. #хорошічаси",0
@user please follow me. i have a technical question. thanks.,"@користувач, будь ласка, підпишись на мене. у мене технічне питання. дякую.",0
"is it wrong of me to not want to read about horrible things in this world, just for one day?",хіба це погано з мого боку не хотіти читати про жахливі речі в цьому світі хоча б один день?,0
"my dad's still gonna get me santa's gifts since it's my last year before 18, but i really don't know what to ask for...","Тато все одно збирається купити мені подарунки від Санти, бо це мій останній рік перед 18-річчям, але я поняття не маю, що просити...",1
about to fuck up this media exam #actuallyihopeso,збираюся завалити цей іспит із медіа #насправді_сподіваюся_на_це,1
"@user excellent, respectful interview of #johnschneider & #tomwopat last week! loved your lack of .","@користувач чудове, сповнене поваги інтерв'ю з джоном шнайдером та томом вопатом минулого тижня! мені сподобалася відсутність іронії.",0
so there used to be a crossfit place here.... #pizzawins,Раніше тут був кросфіт-центр... #піцарулить,1
double standards are always a fun thing,Подвійні стандарти завжди весела штука,1
how can u miss something u never had?||#randomthoughts #miss |http://t.co/g5jly9ikqn,"Як можна сумувати за тим, чого ніколи не мав? || #випадковідумки #сумувати",1
@user great story about the student trying to get the teacher fired!!#moron#storywasstupid,"@користувач, чудова історія про студента, який намагався домогтися звільнення викладача!! #ідіот #історіябулатупою",1
#teenanalcasting #sex sex and the city 2 movie casting auditions nyc summer 2009,"#секс кастинг для фільму Секс і місто 2, Нью-Йорк, літо 2009",0
@user @user i'm off to visit great-nephew very ill,"@користувач їду провідати племінника, він дуже хворий",0
only a true nightshift person would understand this #nightshift #hardcore #teamwork #always...,Тільки справжній працівник нічної зміни зрозуміє це #нічназміна #хардкор #команднаробота #завжди...,0
i'm knitting a scarf. yes. knitting. a scarf. because manual dexterity and i like knitting. problems?,я в’яжу шарф. так. в’яжу. шарф. бо спритність рук і мені подобається в’язати. якісь проблеми?,0
monday morning inspiration! #itstruetho #donttrustnobody #iwokeuplikethis...,Натхнення понеділкового ранку! #цеправда #нікомуневірте #ятакпрокинувся...,1
"shopping day with ms 15 today. her haul included new docs, eyeliner, bras, new issue frankie mag, and half of kikki k. tired and broke now.","День шопінгу з 15-річною пані. Її улов: нові „мартінси“, підводка, ліфчики, свіжий випуск журналу Frankie та половина магазину Kikki K. Тепер я втомлений і без грошей.",0
i do occupy rent free space in his cranial cavity lol @user,я таки займаю безкоштовне місце в його черепній коробці лол @користувач,0
tryna learn to skate tonight! #pennyboard #skate,намагаюся навчитися кататися на скейті сьогодні ввечері! #пенніборд #скейт,1
pretty shitty day i'm gonna be soaked and full of mud and clay #iliketogetdirty really,"Досить паскудний день, я буду весь мокрий, у багнюці та глині. #ялюблюбруднитись.",1
hearing gun shots when i first wake up makes me feel like i'm in compton. what a wonderful way to wake up. ❤ #imscared,"Чую постріли відразу після пробудження, почуваюся як у Комптоні. Чудовий спосіб прокинутися. #меністрашно",1
